Titulo,Autor,Resumen,Etiquetas,Advertencias,Enlace
The Devil's White Knight,orphan_account,"When Harry wakes up in an alternate timeline--a timeline where Voldemort was defeated long before the first war--he discovers everything is different.  His parents, his godfather, his friends--and him.  Harry must deal with the consequences of who he would have been if he had been raised by his parents, and figure out where he stands with his casual hook up, Draco Malfoy.","Explicit, Creator Chose Not To Use Archive Warnings, F/F, M/M, Harry Potter - J. K. Rowling, Draco Malfoy/Harry Potter, Sirius Black/Remus Lupin, Regulus Black/James Potter, Hermione Granger/Viktor Krum, Harry Potter, Draco Malfoy, Sirius Black, Remus Lupin, Regulus Black, James Potter, Nymphadora Tonks, Fleur Delacour, Ron Weasley, Hermione Granger, Teddy Lupin, Alternate Universe- Time Travel, No Voldemort, Alternate Timeline, Everyone lives, past James/Lily - Freeform, Past canon relationships mentions, Enemies to Lovers, Time Travel, PTSD, Post-War Trauma, Unspeakables, Tonks/Fleur - Freeform, Lily/Marlene, Fluff, Friends With Benefits, past George/Harry",Advertencias no encontradas,https://archiveofourown.org/works/6854605
Harry Potter and the Greatest Show,shadowscribe,The last real thing Harry remembers is standing across from Voldemort and watching the killing curse fly at his face.Then he visited a fluffy white limbo that somewhat resembles King Cross Station and instead of choosing to move on or go  back he does something else entirely.And wakes up in his cupboard on the morning of Dudley's eleventh birthday.Because that makes sense.(No. No it doesn't.)But Harry is going to roll with it anyway.,"Mature, Creator Chose Not To Use Archive Warnings, M/M, Harry Potter - J. K. Rowling, Harry Potter/Tom Riddle, Harry Potter/Tom Riddle | Voldemort, Harry Potter, Albus Dumbledore, Tom Riddle | Voldemort, Sirius Black, Remus Lupin, Ron Weasley, Hermione Granger, Severus Snape, Draco Malfoy, Neville Longbottom, Hannah Abbott, Susan Bones, Blaise Zabini, Mandy Brocklehurst, do not copy to another site, Time Travel, Master of Death Harry Potter, Slytherin Harry Potter, Harry living his own life, Harry has no idea what he is doing, but he tries, Moral Ambiguity, Gray Harry, Neutral Harry, Manipulative Albus Dumbledore, but he also tries, it just doesnt work out the way he wants, Slytherins are people too, Work In Progress, irregular updates, Post-Traumatic Stress Disorder - PTSD, Implied/Referenced Child Abuse, Magically Powerful Harry Potter, Paganism, Pagan Festivals, papa snape, Slow Burn, But does it count as slow burn if we are just waiting for Harry to grow up, no beta we die like men, monstrously long fic, seriously, the sort of fic where you sink up to your eyeballs and marinate for a while, it is 120k words before Harry and Tom even talk, this started out as crack but then it got serious, The Author Regrets Nothing",Advertencias no encontradas,https://archiveofourown.org/works/15087428
Full circle,tetsurashian,"(aka 'how to survive endless rebirth with your so-called soulmate')Harry and Tom’s souls are tied together. Which is why they’re in this endless loop of rebirth. At some point, they stopped caring and just started fucking with people.(cracky humor with a hint of seriousness and plot, my specialty)","Not Rated, Creator Chose Not To Use Archive Warnings, M/M, Harry Potter - J. K. Rowling, Harry Potter/Tom Riddle | Voldemort, Harry Potter/Tom Riddle, Harry Potter, Tom Riddle | Voldemort, Alternate Universe, A different kind of soulmate, Master of Death Harry Potter, Reincarnation, Humor, Crack Treated Seriously, Background Relationships",Advertencias no encontradas,https://archiveofourown.org/works/6614155
All the Young Dudes - Sirius's Perspective,Rollercoasterwords,"this is an ATYD fanfic first!!! and a harry potter fanfic only by necessity. this is literally just me rewriting each chapter of atyd but from Sirius's perspective bc i love this story so much and can't get enough of it. all credit for the original work goes to MsKingBean89 and if for some reason you've stumbled upon this without reading the original ATYD first, please go do that!! Read the original here8/24/23PLEASE DON'T POST MY FICS ON GOODREADS/STORYGRAPHS/ETC.PLEASE DON'T REPOST MY WORKS ON ANY OTHER SITES.PLEASE DON'T PRINT OR BIND MY WORKS USING THIRD PARTY SITES THAT MAKE A PROFIT - DO IT BY HAND OR NOT AT ALL. DO NOT SELL BOUND COPIES OF MY FICS.","Mature, Graphic Depictions Of Violence, Major Character Death, No Archive Warnings Apply, M/M, All the Young Dudes - Fandom, Harry Potter - J. K. Rowling, Sirius Black/Remus Lupin, James Potter/Lily Evans Potter, Sirius Black, Remus Lupin, James Potter, Peter Pettigrew, Regulus Black, Lily Evans Potter, Marlene McKinnon, Mary Macdonald, Bellatrix Black Lestrange, Narcissa Black Malfoy, Minerva McGonagall, Albus Dumbledore, Walburga Black, Orion Black, Filius Flitwick, Severus Snape, Horace Slughorn, Poppy Pomfrey, Frank Longbottom, Alice Longbottom, Gideon Prewett (Harry Potter), Fabian Prewett, Arthur Weasley, Caradoc Dearborn, Emmeline Vance, Dorcas Meadowes, Alastor ""Mad-Eye"" Moody, Fleamont Potter, Euphemia Potter, Molly Weasley, Harry Potter, Ron Weasley, Hermione Granger, Fred Weasley, George Weasley, Ginny Weasley, Nymphadora Tonks, Andromeda Black Tonks, Marauders, Marauders Era (Harry Potter), Marauders Friendship (Harry Potter), Slow Burn, Friends to Lovers, fanfic of a fanfic, i would die for mskingbean89, Inspired by All the Young Dudes - MsKingBean89, Angst, Fluff, Fluff and Angst, Requited Love, Canon Compliant, First Kiss, First War with Voldemort, Domestic Violence, Abuse, Mutual Pining, Internalized Homophobia, wolfstar",Advertencias no encontradas,https://archiveofourown.org/works/34577035
Then Comes a Mist and a Weeping Rain,Faith Wood (faithwood),It always rains for Draco Malfoy. Metaphorically. And literally. Ever since he had accidentally Conjured a cloud. A cloud that's ever so cross.,"Explicit, No Archive Warnings Apply, M/M, Harry Potter - J. K. Rowling, Draco Malfoy/Harry Potter, Harry Potter, Draco Malfoy, Gregory Goyle, Millicent Bulstrode, Ernie Macmillan, Hermione Granger, Ron Weasley, Humor, Romance, Hogwarts Eighth Year, HP: EWE, Post - Deathly Hallows, Complete",Advertencias no encontradas,https://archiveofourown.org/works/234222
survival is a talent,ShanaStoryteller,"In the middle of their second year, Draco and Harry discover they're soulmates and do their best to keep it a secret from everyone. Their best isn't perfect. ~“Are you trying to get killed, Potter?” Malfoy drawls, stalking forward. Quick as a serpent himself, he reaches out and grabs the snake just below the head. It thrashes in his grip, but is no longer able to bite anyone. “This is a poisonous snake, and I doubt anyone brought a bezoar with them.” Harry glares. He opens his mouth, and feels the beginning the snake’s language pass his lips, and this isn’t what he wants, what’s the point of insulting Malfoy if he can’t understand him – Malfoy’s eyes widen. He slaps his hand over Harry’s mouth, “Potter, what the hell–”~(Now with a TV Tropes page!)","Teen And Up Audiences, Creator Chose Not To Use Archive Warnings, Gen, M/M, Harry Potter - J. K. Rowling, Draco Malfoy/Harry Potter, Harry Potter, Draco Malfoy, Ron Weasley, Hermione Granger, Blaise Zabini, Millicent Bulstrode, Lucius Malfoy, Narcissa Black Malfoy, Ginny Weasley, Remus Lupin, Sirius Black, Soulmate AU, Indian Harry Potter, Black Hermione Granger, canon? i don't know her, Slow Build, Lucius Malfoy is a bad person but a good father, Parselmouth Harry Potter, Smart Draco Malfoy, I'm offended that's a tag OF COURSE he's smart, sometimes bad things happen, but this fic isn't out to hurt you, Secret Relationship, Slytherins and Gryffindors being reluctant friends, Plotty, suprising lack of focus on soulmates for a soulmate au",Advertencias no encontradas,https://archiveofourown.org/works/12006417
you've got the antidote for me,Kandakicksass,"When Harry Potter unintentionally severs their soulbond before it can fully form, Draco Malfoy resigns himself to a slow death and decides not to burden Harry with a soulmate he's made it very clear he doesn't want.He's never been selfless before, but for Harry, he can try.","Mature, Creator Chose Not To Use Archive Warnings, M/M, Harry Potter - J. K. Rowling, Draco Malfoy/Harry Potter, Hermione Granger/Ron Weasley, Draco Malfoy, Harry Potter, Ron Weasley, Hermione Granger, Penelope Clearwater, Alternate Universe - Soulmates, Soul Bond, Red String of Fate, Heavy Angst, Terminal Illnesses, Major Illness, Angst with a Happy Ending",Advertencias no encontradas,https://archiveofourown.org/works/16138103
The Cadence of Part-time Poets,motswolo,"“They’re… chaos,” Remus said firmly. “And chaos is—”“Rock and roll.”He looked at Sirius sharply, and for once, matched his grin. “Yeah.”“Maybe that’s my excuse then,” Sirius said. “I cause a bit of chaos now, and maybe one day, it’ll turn into rock and roll.”After losing his mother at age eleven, Remus has spent the better part of the last four years bouncing from school to school or else running around London and pretending as though he wasn't the kind of well-bred boy his father brought him up to be. Now, with his chances all run out, Remus is sent to Hawkings Independent School as a last-ditch effort to clean up his act. There he meets the very people who will set up the rest of his life, and is forced to confront the pieces of himself he'd long thought had been lost.(genuinely not apologising for the slow-burn in this fic anymore. You've been warned <3)","Mature, No Archive Warnings Apply, M/M, Harry Potter - J. K. Rowling, Sirius Black/Remus Lupin, James Potter/Lily Evans Potter, Remus Lupin, Sirius Black, James Potter, Peter Pettigrew, Lily Evans Potter, Mary Macdonald, Marlene McKinnon, Minerva McGonagall, Lyall Lupin, Severus Snape, Regulus Black, Dorcas Meadowes, Original Characters, Alternate Universe - Boarding School, Alternate Universe - Rock Band, Band Fic, Marauders Era (Harry Potter), Marauders, wolfstar, jily, POV Remus Lupin, Muggle AU, Recreational Drug Use, Bisexual Remus Lupin, Gay Sirius Black, Lesbian Marlene McKinnon, Hurt/Comfort, Angst with a Happy Ending, Alternate Universe - Muggle, Boarding School, Aromantic Mary Macdonald, Mental Health Issues, Coming of Age, Remus has undiagnosed BPD/Bipolar II Disorder, And experiences intrusive thoughts, But it does not take over the entire fic, Slow Burn, It’s a slow burn. Slow fucking burn. Please take this to heart I mean it, But Remus is taller",Advertencias no encontradas,https://archiveofourown.org/works/30652973
Temptation on the Warfront,alizarincrims0n,"Draco Malfoy is forced into hiding with the Golden Trio and dragged into their search for horcruxes. What ensues is a journey of redemption, unexpected friendships and an unwanted, turbulent romance with Harry Potter. Warnings for swearing, sexual content, and dark themes.","Explicit, No Archive Warnings Apply, M/M, Harry Potter - J. K. Rowling, Draco Malfoy/Harry Potter, Implied Hermione Granger/Ron Weasley - Relationship, Draco Malfoy, Harry Potter, Ron Weasley, Hermione Granger, Remus Lupin, Blaise Zabini, Luna Lovegood, Antonin Dolohov, Horcrux Hunting, Romance, Male Slash, Adventure, Angst and Humor, Deathly Hallows AU, First Time, Sexual Content, Sexual Tension, Snark, Love/Hate, Friendship/Love, POV Switching, Hand Jobs, Unresolved Sexual Tension, Slow Burn, Slash, Alternate Canon",Advertencias no encontradas,https://archiveofourown.org/works/4373594
Wait and Hope,mightbewriting,"“Harry,” Hermione began, voice very controlled, but she could feel the blade of panic slicing at her vocal cords. “Why was Draco Malfoy just screaming bloody murder about his,” and the word almost strangled her as she said it, “wife?”Harry's green eyes blew wide. Healer Lucas pinched the bridge of her nose, clearly displeased with the recent series of events.“He was referring to you, my dear,” she said. “That was the other question you got wrong. Your name is Hermione Jean Granger-Malfoy.”Hermione had to be sedated again.
[In which Hermione loses the last six year's worth of her memories, including the entirety of her relationship and marriage to Draco.]","Mature, No Archive Warnings Apply, F/M, Harry Potter - J. K. Rowling, Hermione Granger/Draco Malfoy, Harry Potter/Ginny Weasley, Hermione Granger, Draco Malfoy, Harry Potter, Ginny Weasley, Ron Weasley, Lavender Brown, Theodore Nott, Blaise Zabini, Pansy Parkinson, Memory Loss, Romance, Slow Burn, draco is trying so hard, hermione is so confused, harry is so harry, ginny is tired because toddlers, ron is very uncomfortable, lavender is there, pansy goes nuclear, theo is trawling for a boyfriend, blaise just wants to have a drink",Advertencias no encontradas,https://archiveofourown.org/works/22818646
Let The Dark In,senlinyu,"In a world where the rise of Voldemort never occurred, Wizarding society has found new ways to repress and exclude those they consider outsiders. Hermione Granger attends Hogwarts as one of the few Muggle-born students. Despite her efforts to make a place for herself, her future seems set in stone until Sixth Year, when the Triwizard Tournament is announced and everything begins to change.
“Bloody hell,” Ron says from beside her. “I think that blond tosser in the front is a Malfoy.”
She tears her eyes away to stare at Ron. “A who?”
He laughs and points at the blond boy. “Malfoy. I dunno his first name, but he’s definitely got to be a Malfoy. Old pureblood family from here in Britain. Bastards, the lot of them. Always Slytherins here at Hogwarts. Heard his dad sent him to Durmstrang because he didn’t want his son near any Muggle-borns.”","Mature, Creator Chose Not To Use Archive Warnings, F/M, Harry Potter - J. K. Rowling, Hermione Granger/Draco Malfoy, Hermione Granger, Draco Malfoy, Harry Potter, Ron Weasley, Viktor Krum, Albus Dumbledore, Ginny Weasley, Cormac McLaggen, Rita Skeeter, Severus Snape, Durmstrang Student Draco Malfoy, Alternate Universe - No Voldemort, Dark Magic, Triwizard Tournament, The Dark Arts (Harry Potter), Morally Grey Hermione Granger, Slow Burn, No Voldemort Does Not Mean No Bigotry, Angst, Hogwarts Sixth Year, Violence, Attempted Sexual Coercion, Triwizard Champion Hermione Granger, Minor Character Death, Implied/Referenced Suicide, Secret Relationship, Bigotry & Prejudice, Sexual Content, Rivals With Benefits, Combat Training As Foreplay",Advertencias no encontradas,https://archiveofourown.org/works/32850244
Dripping Fingers,May_May_0_0,"When Harry finds Tom Riddle's diary he does not write 'Hello.' He does not write anything at all. He draws. Tom Riddle falls in love with the artwork._________________Sketch by sketch, drawing by drawing, the ink Harry pours into the diary manifests as creations in Tom's monochrome world.","Teen And Up Audiences, No Archive Warnings Apply, M/M, Harry Potter - J. K. Rowling, Harry Potter/Tom Riddle, Harry Potter, Tom Riddle, Hermione Granger, Ron Weasley, Petunia Evans Dursley, Dudley Dursley, Bartemius Crouch Jr., Hogwarts Students, Hogwarts Ghosts, Sirius Black, Artist Harry Potter, Lonely Harry Potter, Tom Riddle's Diary, Possessive Tom Riddle, Oblivious Harry, Sad Harry Potter, no bashing of anyone, Canon-Typical Violence, Triwizard Tournament, a severe lack of Dobby, Redemption, Canonical Character Death, Tom Riddle Redemption, Tom Riddle is His Own Warning, Tom Riddle Has Feelings, Eventual Sane Tom Riddle, Angst, Alternate Universe - Canon Divergence, Canon Compliant - Harry Potter and the Philosopher's Stone, Fluff and Angst, Tearjerker, If you read nothing else, Read chapter 16",Advertencias no encontradas,https://archiveofourown.org/works/25440826
Heir Apparent,MonsieurClavier,"When a Voldemort in his thirties encounters a time-travelling, seventeen-year-old Harry Potter, he makes a dangerous—and hilarious—assumption. He assumes that Harry is his son. And his son, of course, deserves the very best.A confused Harry plays along for the sake of self-preservation, but living with his “father” is proving to be intolerable in more ways than one.
“You are mine,” Voldemort said gently, and smiled when Harry flinched. So the boy did know Voldemort, after all. He knew Voldemort was to be feared. “I will look after you, my own.”
“I don’t belong to you,” Harry spat, despite his fear. Oh, what a delight he was! He was no cowering, simpering sycophant, like Voldemort’s other followers; no, this child had a spine of steel. Not many could stand before Voldemort without quailing.
“You are my son,” Voldemort declared. “Of course you belong to me. Your every cell, your every fibre, your every heartbeat. You are mine in flesh and blood and soul. You are mine in magic. And you will not deny me.”
Now with Chinese, Korean, Russian and Portugese translations, and featuring art by Mona and Hypnodisc!","Explicit, No Archive Warnings Apply, M/M, Harry Potter - J. K. Rowling, Harry Potter/Voldemort, Harry Potter/Tom Riddle | Voldemort, Harry Potter/Tom Riddle, Harry Potter, Tom Riddle | Voldemort, Death Eater Characters, Time Travel, Sane Voldemort (Harry Potter), Tom Riddle | Voldemort Adopts Harry Potter, Father-Son Relationship, but not really, Crack Treated Seriously, Drama, Romance, daddy voldie, Daddy Issues, POV Tom Riddle, Possessive Behavior, Possessive Tom Riddle, Protective Tom Riddle, Powerful Harry, Snark, Sassy Harry Potter, Awkward Conversations, Living Together, Enemies to Family to Lovers, the weirdest relationship development you've ever seen, okay maybe not the weirdest, but it's probably at least in the top 5, Pseudo-Incest, Fucked Up, Twisted and Fluffy Feelings, Voldemort Has No Moral Filter, Harry Has No Verbal Filter, so what else is new, Inappropriate Behavior, BDSM Fantasies, All In Voldemort's Head, ferrealz dude this is your SON, maybe stop being a creep for like 5 minutes?, death eater fam, Sugar Daddy, Redemption, Psychopaths In Love, Falling In Love, Yandere, Slow Burn, Opposites Attract, Sexual Tension, Fluff and Angst, Touching, So Much Touching, damn voldie why can't you keep your hands off your son, Humor, Comedy of Errors, Mutual Pining, Happy Ending, Intense, Passion, Soul Bond, Soulmates, EXTREMELY INTENSE ROMANCE, tone it down voldie sheesh, don't just jizz your feelings all over harry, POV Voldemort (Harry Potter), surprisingly wholesome despite its depravity, in fact ‘wholesome depravity’ is a pretty good description of this story, Warning: May Cause Hysterical Laughter and Uncomfortable Arousal, At the same time",Advertencias no encontradas,https://archiveofourown.org/works/25010857
Right Hand Red,lq_traintracks (lumosed_quill),"Harry felt Malfoy's breath on his lips as they came together over the bottle, hands firmly planted on the floor as though they each needed their familiar soil, refusing to cross into enemy territory. Except that Malfoy no longer felt like his enemy.  Malfoy felt inevitable.","Explicit, No Archive Warnings Apply, M/M, Harry Potter - J. K. Rowling, Draco Malfoy/Harry Potter, Hermione Granger, Ron Weasley, Pansy Parkinson, Seamus Finnigan, Ginny Weasley, Neville Longbottom, Luna Lovegood, Millicent Bulstrode, Dean Thomas, Blaise Zabini, Parvati Patil, Padma Patil, Portrait Severus Snape, Gordon the Ferret, OMC, Minerva McGonagall, Hogwarts Eighth Year, Unresolved Sexual Tension, Unresolved Romantic Tension, Bottom Draco, future switching, Party Games, Drunkenness, Hand Jobs, Blow Jobs, Anal Sex, First Time, Loss of Virginity, Secret Relationship, Angst and Humor",Advertencias no encontradas,https://archiveofourown.org/works/3178065
What We Pretend We Can't See,gyzym,"Seven years out from the war, Harry learns the hard truth of old history: it’s never quite as far behind you as you thought.","Mature, No Archive Warnings Apply, M/M, Harry Potter - J. K. Rowling, Draco Malfoy/Harry Potter, Hermione Granger/Ron Weasley, Neville Longbottom/Ginny Weasley",Advertencias no encontradas,https://archiveofourown.org/works/9794657
Tea and No Sympathy,who_la_hoop,"It's Potter's fault, of course, that Draco finds himself trapped in the same twenty-four-hour period, repeating itself over and over again. It's been nearly a year since the unpleasant business at Hogwarts, and Draco's getting on with his life quite nicely, thank you, until Harry sodding Potter steps in and ruins it all, just like always. At first, though, the time loop seems liberating. For the first time in his life, he can do anything, say anything, be anything, without consequence. But the more Draco repeats the day, the more he realises the uncomfortable truth: he's falling head over heels for the speccy git. And suddenly, the time loop feels like a trap. For how can he ever get Harry to love him back when time is, quite literally, against him?","Explicit, No Archive Warnings Apply, M/M, Harry Potter - J. K. Rowling, Draco Malfoy/Harry Potter, Narcissa Malfoy, Lucius Malfoy, Hermione Granger, Ron Weasley, Aberforth Dumbledore, Rubeus Hagrid, Buckbeak, Justin Finch-Fletchley, Ernie Macmillan, Terence Higgs, Minerva McGonagall, Giant Squid (Harry Potter), Slow Build, Draco-centric, Tea Drinking, Swearing, Muggle London, Houses of Parliament, Malfoy Manor, flangst, Family Feels, Muggle/Wizard Relations, Coming Out, Heartfelt Conversations, Sarcastic Conversations, Owls, Competitive Card Games, Falling In Love, getting drunk, Enthusiastic Snogging, Hogwarts Castle, Sex In The Slytherin Dormitory, Frottage, Time Travel, Time Loop, HP: EWE",Advertencias no encontradas,https://archiveofourown.org/works/2734082
Soup-pocalypse and The Great Curry Cataclysm,SquadOfCats,"Eleven years after the war, Draco Malfoy leads a quiet, boring, and perfectly respectable life, thanks very much. Or, at least he does, until a sudden and very unexpected veela awakening causes him to throw soup all over Harry Potter in the middle of the Ministry cafeteria.","Explicit, No Archive Warnings Apply, M/M, Harry Potter - J. K. Rowling, Draco Malfoy/Harry Potter, Harry Potter, Draco Malfoy, Teddy Lupin, Hermione Granger, Ron Weasley, Lavender Brown, Veela Draco Malfoy, Veela Mates, Teddy Lupin was Raised by Harry Potter, Parent Harry Potter, Depression, Mental Health Issues, Slow Burn, Enemies to Lovers, Angst, Humor, Hurt/Comfort, Explicit Sexual Content, Bottom Draco Malfoy, Top Harry Potter, Past Suicide Attempt, H/D Food Fair 2018, Ministry of Magic Employee Draco Malfoy, Harry Potter Thinks Draco Malfoy is Up to Something, Draco Malfoy Cooks, Courtship, Food Issues, Romance, Pining Draco Malfoy, Auror Harry Potter, Post-Hogwarts, Harry Potter Epilogue What Epilogue | EWE",Advertencias no encontradas,https://archiveofourown.org/works/16036310
Away Childish Things,lettered,Harry gets de-aged.  Malfoy has to help him.,"Teen And Up Audiences, No Archive Warnings Apply, M/M, Harry Potter - J. K. Rowling, Draco Malfoy/Harry Potter, Draco Malfoy, Harry Potter, Age Regression/De-Aging, Past Child Abuse, Past Malnutrition, Past Neglect, Past Touch Deprivation, Dyslexia, Eating Disorders, Verbal Abuse, Internalized Homophobia, Homophobia, Biphobia, Homophobic Slurs, Pure-blood Bigotry, Pure-blood Slurs, Crying, Grief/Mourning, Off-screen death of a secondary character, the Death is an Implied Suicide, Mommy Issues, Daddy Issues, Toxic Masculinity, Long Hair, Emotional Dysfunction, Age Difference, Blood, Bodyswap (kind of), Love Potion/Spell, Potions Accident, Family, Hurt/Comfort, heavy on the comfort, Endearments, Bacon, salad",Advertencias no encontradas,https://archiveofourown.org/works/16052816
Mental,sara_holmes,"Harry has had quite enough of sharing his mind with someone else, thankyouverymuch. A miscast Legilimecy spell says otherwise.(Fic from 2010 FF archive being uploaded here.)AND FOR THE LAST FUCKING TIME, STOP REPOSTING THIS ON WATTPAD. I DO NOT WANT IT ON WATTPAD. YOU DO NOT HAVE PERMISSION TO POST THIS ON WATTPAD.","Mature, Creator Chose Not To Use Archive Warnings, M/M, Harry Potter - J. K. Rowling, Draco Malfoy/Harry Potter, Ron Weasley, Hermione Granger, Various Characters, Romance, Slow Build, Getting Together, Angst and Humor, Coming Out, Developing Relationship, Legilimency, Mind Control, Magical Accidents, Accidental Bonding, of sorts, Mind Meld, Swearing, Hogwarts Eighth Year",Advertencias no encontradas,https://archiveofourown.org/works/5163386
Hermione Granger's Hogwarts Crammer for Delinquents on the Run,waspabi,"'You're a wizard, Harry' is easier to hear from a half-giant when you're eleven, rather than from some kids on a tube platform when you're seventeen and late for work.","Teen And Up Audiences, No Archive Warnings Apply, M/M, Harry Potter - J. K. Rowling, Draco Malfoy/Harry Potter, Hermione Granger/Ron Weasley, Harry Potter, Draco Malfoy, Hermione Granger, Ron Weasley, Luna Lovegood, Ginny Weasley, Neville Longbottom, Pining, Humor, Hijinks & Shenanigans, Alternate Universe - Canon Divergence, Friendship",Advertencias no encontradas,https://archiveofourown.org/works/7331278
An Issue of Consequence,Faith Wood (faithwood),Draco has woken up in an alternate universe. Or he has woken up utterly insane. Nothing else can possibly explain why Harry Potter suddenly seems to think he's Draco's boyfriend.,"Explicit, No Archive Warnings Apply, M/M, Harry Potter - J. K. Rowling, Draco Malfoy/Harry Potter, Draco Malfoy, Harry Potter, Blaise Zabini, Pansy Parkinson, HP: EWE, Hogwarts Eighth Year, Romance, Mystery, Humor, Explicit Sexual Content, Potions",Advertencias no encontradas,https://archiveofourown.org/works/1439476
