Titulo,Autor,Resumen,Etiquetas,Advertencias,Enlace
Running on Air,eleventy7,Draco Malfoy has been missing for three years. Harry is assigned the cold case and finds himself slowly falling in love with the memories he collects.,"Teen And Up Audiences, No Archive Warnings Apply, Multi, Harry Potter - J. K. Rowling, Draco Malfoy/Harry Potter, Harry/Ginny, past Draco/Astoria, Draco Malfoy, Harry Potter, Hermione Granger, Ron Weasley, Astoria Greengrass, Ginny Weasley, Mystery, Drama, Friendship, Slow Burn, Romance",Advertencias no encontradas,https://archiveofourown.org/works/3171550
We're Already Married,XxTheDarkLordxX,"""Our whole lives we have always told people that we were married. I knew that it wasn't exactly normal but it was always something that filled me with so much affection for you. I have loved you for so long. Longer than I ever realized."" Harry took a deep breath as he looked into shining silver eyes.Or...Three-year-old Harry asks little Draco to marry him and they insist to anyone who will listen that they are indeed already married.","Teen And Up Audiences, No Archive Warnings Apply, M/M, Harry Potter - J. K. Rowling, Draco Malfoy/Harry Potter, Sirius Black/Remus Lupin, Lucius Malfoy/Narcissa Black Malfoy, Draco Malfoy, Harry Potter, Sirius Black, Remus Lupin, Lucius Malfoy, Narcissa Black, Fluff, Tooth-Rotting Fluff, Kid Fic, to adults, Adorable, No Angst, Romance, Best Friends, Friends to Lovers, Sirius ships it, Remus is so done",Advertencias no encontradas,https://archiveofourown.org/works/12312867
Remain Nameless,HeyJude19,"How did it feel? It felt like he was barely holding it together. She, of all people, should shun him. Or yell at him. Curse him. Spit at him. Take out her wand and blast him off the face of the earth. It was crushing guilt and relief and confusion all at once when he looked at Hermione Granger.The monotony of Draco’s daily routine had become both a lifeline and a noose. But this new habit of grabbing coffee with Hermione Granger is quickly becoming a reason to get out of bed and is unfortunately forcing him to re-evaluate his inconsequential existence.Hermione is living her life in fragments, separate pieces scattered about, and she can’t find a way to step back and let the full picture form. Why are morning meetings with Draco Malfoy the only thing that make sense anymore?","Explicit, No Archive Warnings Apply, F/M, Harry Potter - J. K. Rowling, Hermione Granger/Draco Malfoy, Harry Potter/Ginny Weasley, Padma Patil/Ron Weasley, Theodore Nott, Narcissa Black Malfoy, Luna Lovegood, Original Characters, Susan Bones, Weasley Family (Harry Potter), Astoria Greengrass, Pansy Parkinson, Minerva McGonagall, Dennis Creevey, Parvati Patil, Romance, Angst, Fluff and Angst, Post-Hogwarts, Harry Potter Epilogue What Epilogue | EWE, Slow Burn, Friends to Lovers, Mutual Pining, POV Draco Malfoy, POV Hermione Granger, Post-Traumatic Stress Disorder - PTSD, Past Drug Addiction, Healing, Sexual Content, Explicit Language, Cross-Posted on FanFiction.Net, Explicit Sexual Content, Enthusiastic Consent, Slow Romance, blueberry scones, Suicidal Thoughts, Cross-Posted on Wattpad, Angst with a Happy Ending, HEA",Advertencias no encontradas,https://archiveofourown.org/works/23875939
Text Talk,merlywhirls,"Sirius is in boarding school, Remus is in hospital, and they don't know each other until Sirius texts the wrong number.","Not Rated, Creator Chose Not To Use Archive Warnings, No Archive Warnings Apply, Harry Potter - J. K. Rowling, Sirius Black/Remus Lupin, wolfstar - Relationship, Sirius Black, Remus Lupin, James Potter, Peter Pettigrew, Moony, Wormtail, Padfoot, Prongs, Lily Evans, Lily Potter, Alice Longbottom, Frank Longbottom, text, Texting, text fic, Hospital, Boarding School, MWPP, Marauders era, The Marauders - Freeform, Maurders AU, AU, Alternate Universe, Modern AU, texting fic, School, Injury, Mention of family abuse, mention of depression, family stuff, Parents, Illness, Homophobic Slurs, Mention Of Homophobia",Advertencias no encontradas,https://archiveofourown.org/works/1651109
Draco Malfoy and the Mortifying Ordeal of Being in Love,isthisselfcare,"Hermione straddles the Muggle and Magical worlds as a medical researcher and Healer about to make a big discovery. Draco is an Auror assigned to protect her from forces unknown – to both of their displeasure.Features hyper-competent, fiery Hermione and lazy, yet dangerous, Draco. Slow burn.","Explicit, Graphic Depictions Of Violence, F/M, Harry Potter - J. K. Rowling, Hermione Granger/Draco Malfoy, Draco Malfoy, Hermione Granger, Healer Hermione Granger, Researcher Hermione Granger, Auror Draco Malfoy, Slow Burn, Unresolved Sexual Tension, Eventual Smut, POV Draco Malfoy, Forced Collaboration, Romance, romcom, Action/Adventure, EWE, HEA, reckless overuse of author's favourite tropes, oblivious idiots, All aboard the SS Denial, late-stage pining, what is pining if not denial persevering, No first names we die like men, do not look too closely at the plot you will only hurt yourself, scandalous ankle touching, misuse of whirlpool baths, graphic depictions of competent women, eroticised arithmancy, Crookshanks will fight god or become him, human on mushroom violence, Schrödinger's ethics, Nuns",Advertencias no encontradas,https://archiveofourown.org/works/34500952
hello goodbye ('twas nice to know you),tamerofdarkstars,"Draco Malfoy thinks he might know whose thoughts are scrawling themselves on his skin, but that's crazy. Impossible, even. It has to be a mistake.-Self-indulgent soulmate AU where the thoughts of your soulmate inscribe themselves on your skin in a shifting magic tattoo","Teen And Up Audiences, No Archive Warnings Apply, M/M, Harry Potter - J. K. Rowling, Draco Malfoy/Harry Potter, Draco Malfoy, Harry Potter, Blaise Zabini, Dean Thomas, Seamus Finnigan, Ensemble, Soulmate-Identifying Marks, Alternate Universe - Soulmates, finally finished this holy hell, Fluff, seriously so much fluff, Hogwarts Eighth Year, Spanish Translation, 中文翻译 | Translation in Chinese, Перевод на русский | Translation in Russian, Korean Translation",Advertencias no encontradas,https://archiveofourown.org/works/4371455
In Evidence of Magical Theory,bixgirl1,"When a hex meant for Draco accidentally catches Harry as well, they're forced to learn to understand each other in ways they previously might have thought impossible.In which Harry and Draco can't fight, so they fall in love instead.","Explicit, Creator Chose Not To Use Archive Warnings, M/M, Harry Potter - J. K. Rowling, Draco Malfoy/Harry Potter, Draco Malfoy, Harry Potter, Hermione Granger, Ron Weasley, Pansy Parkinson, Blaise Zabini, Minerva McGonagall, OMC, Hogwarts Eighth Year, Accidental Bonding, Magical Theory, Magical Cores, Powerful Harry, Rimming, Anal Sex, Anal Fingering, Switching, Slash, HP: EWE, Falling In Love, forced bed sharing, Blow Jobs, completed fic, Bonding, Forced Proximity, Sharing a Bed, First Time, Loss of Virginity",Advertencias no encontradas,https://archiveofourown.org/works/9174820
Who Shagged Harry Potter?,Faith Wood (faithwood),"One beautiful sunny Sunday the Slytherins wake up after a raunchy night only to discover a very naked Harry Potter sleeping in their dormitory. Naturally, they ask themselves a logical question: Who the hell shagged him?","Explicit, No Archive Warnings Apply, M/M, Harry Potter - J. K. Rowling, Draco Malfoy/Harry Potter, Draco Malfoy, Harry Potter, Blaise Zabini, Theodore Nott, Gregory Goyle, Smut, Humor, Hogwarts Eighth Year",Advertencias no encontradas,https://archiveofourown.org/works/392041
"Hey, Potter",SunseticMonster,"Harry returns to Hogwarts for his 8th year, determined not to let Malfoy get to him. But when the snarky teasing starts up again, Harry finds that returning the jibes with compliments has a far more interesting outcome.","Mature, Creator Chose Not To Use Archive Warnings, M/M, Harry Potter - J. K. Rowling, Draco Malfoy/Harry Potter, Draco Malfoy, Harry Potter, Ron Weasley, Gregory Goyle, Pansy Parkinson, Ghosts, Drinking, Mind/Mood Altering Substances, Hogwarts Eighth Year, Alcohol, Drama, Fluff and Angst, Humor",Advertencias no encontradas,https://archiveofourown.org/works/787368
All Our Secrets Laid Bare,firethesound,"Over the six years Draco Malfoy has been an Auror, four of his partners have turned up dead. Harry Potter is assigned as his newest partner to investigate just what is going on.","Explicit, Creator Chose Not To Use Archive Warnings, M/M, Harry Potter - J. K. Rowling, Draco Malfoy/Harry Potter, Hermione Granger/Ron Weasley, Harry Potter/Original Male Character(s), Draco Malfoy, Harry Potter, Ron Weasley, Hermione Granger, Original Male Character(s), Original Female Character(s), Lucius Malfoy, Narcissa Black Malfoy, Kingsley Shacklebolt, Auror Partners, Sexual Content, Wandless Magic, Mystery, Investigations, Magical Tattoos, Getting Together, Trapped, Secrets, Secret Relationship, Shower Sex, First Time, Loss of Virginity, Blow Jobs, Office Sex, Duelling, Falling In Love, Hats, Glasses, Curry, Tea, Bars and Pubs, Hoodies",Advertencias no encontradas,https://archiveofourown.org/works/1227880
you belong to me (i belong to you),Child_OTKW,"“What I find absolutely fascinating,” Riddle said, stalking closer, “is you.” He marched forward, backing Harry up until he was pinned to the cool wall of the common room. “Do you know why?”

“No. And I’ll be honest here, Riddle, I don’t particularly care.”

The taller boy grinned at him, small yet infinitely pleased. “That. Right there.” One hand rose and brushed some of Harry’s fringe from his face. “Nathan Ciro was a spineless little boy too afraid of his own shadow to dare even glance in my direction. But you…”

He leaned closer, “You look at me like you want to stab me.”
After an accident, Auror Harry Potter wakes up in the body of fourteen year old Nathan Ciro, a tormented Slytherin who recently tried to end his own life. Seeking answers to his strange predicament, Harry returns to Hogwarts, and causes quite the stir through staff and students - especially when they come to realise he is not the same boy as before.He tries to avoid suspicion, but as his quest for the truth draws more and more attention to him, Harry begins to think that he might not like what he will discover.","Not Rated, Graphic Depictions Of Violence, Rape/Non-Con, Underage Sex, Harry Potter - J. K. Rowling, Harry Potter & Tom Riddle, Death & Harry Potter, Orion Black & Harry Potter, Harry Potter, Tom Riddle, Orion Black, Albus Dumbledore, Gellert Grindelwald, Lestrange Sr. (Harry Potter), Original Characters, Death (Harry Potter), Time Travel, Body Swap, Riddle at Hogwarts Era, Slytherin Politics, Slytherin Harry, Grey Harry, Auror Harry, Mind Games, Obsessive Behavior, Possessive Behavior, Implied/Referenced Rape/Non-con, Rape Aftermath, Underage Rape/Non-con, Suicide Attempt, The Non-con is not between Harry and Tom, Master of Death Harry Potter, Mild Horror, Minor Harry Potter/Ginny Weasley, Technically pre-relationship - Freeform, Tags May Change",Advertencias no encontradas,https://archiveofourown.org/works/11270490
Three's Family,darkbluedark,"It’s May 1979 and the Order has just apprehended a pair of mysterious wizards who look remarkably like a Potter and a Malfoy. Naturally, James Potter and Sirius Black are called in to identify the strangely familiar strangers and determine their backgrounds and loyalties.(This would be a lot easier if their captives weren’t convinced everyone they talk to is dead. It would also be easier if they didn’t spend half their bloody time bickering.)**“Just ask them questions only they would know the answer to,” Malfoy suggests.“There’s not a single thing that I know about either of them from the first war that any old Death Eater couldn’t find out.”“How is that possible?” Malfoy huffs. “He’s your father!”“Am I or am I not famously an orphan?” Potter snarls.**Русский перевод: https://archiveofourown.org/works/49365862/chapters/124574398中文翻译: https://archiveofourown.org/works/49899721","Teen And Up Audiences, No Archive Warnings Apply, F/M, Gen, Harry Potter - J. K. Rowling, James Potter/Lily Evans Potter, Draco Malfoy & Harry Potter, background Remus Lupin/Sirius Black - Relationship, Sirius Black & James Potter, Harry Potter & James Potter & Lily Evans Potter, Harry Potter, Draco Malfoy, James Potter, Lily Evans Potter, Sirius Black, Albus Dumbledore, Dorcas Meadowes, Time Travel, Time Travel Fix-It, Fluff and Humor, And Hard Truths, First Wizarding War with Voldemort (Harry Potter), Marauders Era (Harry Potter), Found Family, LITERALLY, proposal, not drarry, unless you consider bickering to be foreplay in which case you may consider this pre-slash, Enemies to reluctant allies, Time Travelling Harry Potter",Advertencias no encontradas,https://archiveofourown.org/works/42356628
